ACIKLAMA,BASLIK,LINK
"Murat Mahallesi, Talatpaşa Caddesi, No: 82/5 (RYS Hotel Altı); MERKEZ / Edirne. Pena Performance Hall Edirne, sevdiğiniz sanatçıları sahnesinde ağırlamaya ...",Pena Performance Hall Edirne Edirne biletleri.,https://www.biletix.com/mekan/FD/ISTANBUL/tr
Edirne was finally conquered by Sultan Murat I in 1361 and became the throne ( head) city of the Ottoman Empire and remained as a capital city (Payitaht) for 92 ...,Edirne – Places of Peace,https://placesofpeace.eu/destinations/edirne/
EDİRNE TAPU MÜDÜRLÜĞÜ. Telefon. 0284 280 11 33. Mail. edirne-tsm@tkgm. gov.tr. Adres. İstasyon Mah. Şehit Emniyet Müdürü Ertan Nezihi TURAN Cad.,EDİRNE TAPU MÜDÜRLÜĞÜ | TKGM,https://www.tkgm.gov.tr/edirne-bm/edirne-tapu-mudurlugu
Edirne ve çevresinde keşfedilecek birçok nokta olduğu için Edirne araç kiralama hizmeti almak büyük bir konfor anlamına geliyor. Siz de bu eşsiz şehri ziyaret ...,Edirne Gezilecek Yerler | Avis Türkiye,https://www.avis.com.tr/avis-ile-seyahat/edirne-gezi-rehberi
Edirne Gençlik ve Spor İl Müdürlüğü.,EDİRNE GENÇLİK VE SPOR İL MÜDÜRLÜĞÜ,http://edirne.gsb.gov.tr/
EDİRNE. BAROSU EDİRNE BAR ASSOCIATION. Atatürk. ANASAYFA- BAROMUZ. YÖNETİM KURULU · DENETLEME KURULU · DİSİPLİN KURULU · TBB ...,EDİRNE BAROSU | www.edirnebarosu.org.tr,http://www.edirnebarosu.org.tr/
"EDİRNE 112 ACİL ÇAĞRI MERKEZİ MÜDÜRLÜĞÜ. Adres. Fatih, İbrahim Zagra Cd., 22030 Edirne Merkez/Edirne. E-Posta. -. Telefon. 0 (284) 213 91 84. Fax.",Edirne 112 Acil Çağrı Merkezi Müdürlüğü,https://www.112.gov.tr/edirne
Son dakika Edirne haberlerini buradan takip edebilirsiniz. En son edirne haberleri anında burada. 04:53 ...,Son Dakika Edirne Haberleri - Edirne Son Dakika,https://www.sondakika.com/edirne/
"2010 yılında Selimiye Camii ile UNESCO Dünya Miras Listesi'ne giren Edirne, aynı zamanda popüler bir turistik destinasyon haline gelmiştir. Artan turist sayısını  ...",Ana Sayfa - Edirne ve Nessebar'ı Keşfet,https://www.edirnevisit.com/
"... Report v.2 - Edirne, Pazarkule Border, Turkey, 5th March 2020. Format: Situation Report; Source. STL. Posted: 6 Mar 2020; Originally published: 5 Mar 2020 ...","STL Situation Report v.2 - Edirne, Pazarkule Border, Turkey, 5th ...",https://reliefweb.int/report/turkey/stl-situation-report-v2-edirne-pazarkule-border-turkey-5th-march-2020
